00:32:21.775358 IP router.guest.corp.microsoft.com.38491 > M.ROOT-SERVERS.NET.domain: 13028 [1au] NS? . (40)
00:32:22.987488 IP router.guest.corp.microsoft.com.35496 > M.ROOT-SERVERS.NET.domain: 49393 [1au] DS? com. (44)
00:32:23.255835 IP router.guest.corp.microsoft.com.40307 > cusgaibluf5b01--commoncorp2-ip2.network.microsoft.com.domain: 49813+% [1au] A? twitter.com. (52)
00:32:23.261791 IP cusgaibluf5b01--commoncorp2-ip2.network.microsoft.com.domain > router.guest.corp.microsoft.com.40307: 49813 2/0/1 A 104.244.42.65, A 104.244.42.129 (72)
00:32:24.188376 IP router.guest.corp.microsoft.com.38111 > G.ROOT-SERVERS.NET.domain: 22091 [1au] NS? . (40)
00:32:25.400637 IP router.guest.corp.microsoft.com.57946 > G.ROOT-SERVERS.NET.domain: 4406 [1au] DS? com. (44)
00:32:29.427328 IP router.guest.corp.microsoft.com.57154 > cusgaibluf5b01--commoncorp2-ip2.network.microsoft.com.domain: 63830+% [1au] A? ntp.ubuntu.com. (55)
00:32:29.427569 IP router.guest.corp.microsoft.com.40012 > cusgaibluf5b01--commoncorp2-ip2.network.microsoft.com.domain: 20963+% [1au] AAAA? ntp.ubuntu.com. (55)
00:32:29.433822 IP cusgaibluf5b01--commoncorp2-ip2.network.microsoft.com.domain > router.guest.corp.microsoft.com.57154: 63830 4/0/1 A 91.189.89.198, A 91.189.89.199, A 91.189.91.157, A 91.189.94.4 (107)
00:32:29.434092 IP router.guest.corp.microsoft.com.42297 > cusgaibluf5b01--commoncorp2-ip2.network.microsoft.com.domain: 55562+% [1au] DS? com. (44)
00:32:29.434783 IP cusgaibluf5b01--commoncorp2-ip2.network.microsoft.com.domain > router.guest.corp.microsoft.com.40012: 20963 2/0/1 AAAA 2001:67c:1560:8003::c8, AAAA 2001:67c:1560:8003::c7 (99)
00:32:30.236915 IP6 router.55983 > 2001:4898::1050:5050.domain: 1370+ [1au] PTR? 42.83.7.199.in-addr.arpa. (53)
00:32:31.260698 IP6 router.47582 > 2001:4898::1050:5050.domain: 36313+ [1au] PTR? 0.5.0.5.0.5.0.1.0.0.0.0.0.0.0.0.0.0.0.0.0.0.0.0.8.9.8.4.1.0.0.2.ip6.arpa. (101)
00:32:31.268430 IP6 2001:4898::1050:5050.domain > router.47582: 36313 NXDomain 0/1/1 (181)
00:32:31.268595 IP6 router.47582 > 2001:4898::1050:5050.domain: 36313+ PTR? 0.5.0.5.0.5.0.1.0.0.0.0.0.0.0.0.0.0.0.0.0.0.0.0.8.9.8.4.1.0.0.2.ip6.arpa. (90)
00:32:31.276062 IP6 2001:4898::1050:5050.domain > router.47582: 36313 NXDomain 0/1/0 (170)
00:32:31.276784 IP6 router.55349 > 2001:4898::1050:5050.domain: 21609+ [1au] PTR? a.0.a.9.0.4.e.f.f.f.d.5.5.1.2.0.c.8.3.0.0.e.0.0.8.9.8.4.1.0.0.2.ip6.arpa. (101)
00:32:31.282515 IP6 2001:4898::1050:5050.domain > router.55349: 21609 NXDomain 0/1/1 (181)
00:32:31.282685 IP6 router.55349 > 2001:4898::1050:5050.domain: 21609+ PTR? a.0.a.9.0.4.e.f.f.f.d.5.5.1.2.0.c.8.3.0.0.e.0.0.8.9.8.4.1.0.0.2.ip6.arpa. (90)
00:32:31.288180 IP6 2001:4898::1050:5050.domain > router.55349: 21609 NXDomain 0/1/0 (170)
00:32:32.649089 IP router.guest.corp.microsoft.com.38503 > M.ROOT-SERVERS.NET.domain: 4078 [1au] NS? . (40)
00:32:33.860465 IP router.guest.corp.microsoft.com.38727 > M.ROOT-SERVERS.NET.domain: 46449 [1au] DS? com. (44)
00:32:35.872467 IP router.guest.corp.microsoft.com.58664 > G.ROOT-SERVERS.NET.domain: 61917 [1au] NS? . (40)
00:32:37.076425 IP router.guest.corp.microsoft.com.47357 > G.ROOT-SERVERS.NET.domain: 50846 [1au] DS? com. (44)
00:32:51.004498 IP router.guest.corp.microsoft.com.55573 > cusgaibluf5b01--commoncorp2-ip2.network.microsoft.com.domain: 17064+% [1au] A? ntp.ubuntu.com. (55)
00:32:51.004804 IP router.guest.corp.microsoft.com.55277 > cusgaibluf5b01--commoncorp2-ip2.network.microsoft.com.domain: 1934+% [1au] AAAA? ntp.ubuntu.com. (55)
00:32:51.010268 IP cusgaibluf5b01--commoncorp2-ip2.network.microsoft.com.domain > router.guest.corp.microsoft.com.55277: 1934 2/0/1 AAAA 2001:67c:1560:8003::c8, AAAA 2001:67c:1560:8003::c7 (99)
00:32:51.010545 IP router.guest.corp.microsoft.com.60847 > cusgaibluf5b01--commoncorp2-ip2.network.microsoft.com.domain: 64899+% [1au] DS? com. (44)
00:32:51.014323 IP cusgaibluf5b01--commoncorp2-ip2.network.microsoft.com.domain > router.guest.corp.microsoft.com.55573: 17064 4/0/1 A 91.189.89.198, A 91.189.89.199, A 91.189.91.157, A 91.189.94.4 (107)
00:32:54.226948 IP router.guest.corp.microsoft.com.57199 > M.ROOT-SERVERS.NET.domain: 60083 [1au] NS? . (40)
00:32:55.450304 IP router.guest.corp.microsoft.com.53125 > M.ROOT-SERVERS.NET.domain: 15953 [1au] DS? com. (44)

