00:32:21.377846 IP router.guest.corp.microsoft.com.60306 > f.root-servers.net.domain: 49107 [1au] DS? com. (44)
00:32:21.775358 IP router.guest.corp.microsoft.com.38491 > M.ROOT-SERVERS.NET.domain: 13028 [1au] NS? . (40)
00:32:22.180426 IP router.guest.corp.microsoft.com.51257 > c.root-servers.net.domain: 21633 [1au] DS? com. (44)
00:32:22.580378 IP router.guest.corp.microsoft.com.57513 > j.root-servers.net.domain: 61504 [1au] NS? . (40)
00:32:22.987488 IP router.guest.corp.microsoft.com.35496 > M.ROOT-SERVERS.NET.domain: 49393 [1au] DS? com. (44)
00:32:23.255835 IP router.guest.corp.microsoft.com.40307 > cusgaibluf5b01--commoncorp2-ip2.network.microsoft.com.domain: 49813+% [1au] A? twitter.com. (52)
00:32:23.261791 IP cusgaibluf5b01--commoncorp2-ip2.network.microsoft.com.domain > router.guest.corp.microsoft.com.40307: 49813 2/0/1 A 104.244.42.65, A 104.244.42.129 (72)
00:32:23.384363 IP router.guest.corp.microsoft.com.54928 > e.root-servers.net.domain: 33198 [1au] NS? . (40)
00:32:23.790828 IP router.guest.corp.microsoft.com.54652 > j.root-servers.net.domain: 51473 [1au] DS? com. (44)
00:32:24.188376 IP router.guest.corp.microsoft.com.38111 > G.ROOT-SERVERS.NET.domain: 22091 [1au] NS? . (40)
00:32:24.596860 IP router.guest.corp.microsoft.com.55866 > e.root-servers.net.domain: 5758 [1au] DS? com. (44)
00:32:24.992386 IP router.guest.corp.microsoft.com.46395 > b.root-servers.net.domain: 51830 [1au] NS? . (40)
00:32:25.400637 IP router.guest.corp.microsoft.com.57946 > G.ROOT-SERVERS.NET.domain: 4406 [1au] DS? com. (44)
00:32:25.796371 IP router.guest.corp.microsoft.com.51740 > a.root-servers.net.domain: 21692 [1au] NS? . (40)
00:32:26.210600 IP router.guest.corp.microsoft.com.34852 > b.root-servers.net.domain: 7548 [1au] DS? com. (44)
00:32:26.604371 IP router.guest.corp.microsoft.com.33328 > k.root-servers.net.domain: 50682 [1au] NS? . (40)
00:32:27.016374 IP router.guest.corp.microsoft.com.38278 > a.root-servers.net.domain: 26448 [1au] DS? com. (44)
00:32:27.408727 IP router.guest.corp.microsoft.com.33134 > h.root-servers.net.domain: 2731 [1au] NS? . (40)
00:32:29.427328 IP router.guest.corp.microsoft.com.57154 > cusgaibluf5b01--commoncorp2-ip2.network.microsoft.com.domain: 63830+% [1au] A? ntp.ubuntu.com. (55)
00:32:29.427451 IP router.guest.corp.microsoft.com.34792 > i.root-servers.net.domain: 19697 [1au] NS? . (40)
00:32:29.427569 IP router.guest.corp.microsoft.com.40012 > cusgaibluf5b01--commoncorp2-ip2.network.microsoft.com.domain: 20963+% [1au] AAAA? ntp.ubuntu.com. (55)
00:32:29.433822 IP cusgaibluf5b01--commoncorp2-ip2.network.microsoft.com.domain > router.guest.corp.microsoft.com.57154: 63830 4/0/1 A 91.189.89.198, A 91.189.89.199, A 91.189.91.157, A 91.189.94.4 (107)
00:32:29.434092 IP router.guest.corp.microsoft.com.42297 > cusgaibluf5b01--commoncorp2-ip2.network.microsoft.com.domain: 55562+% [1au] DS? com. (44)
00:32:29.434783 IP cusgaibluf5b01--commoncorp2-ip2.network.microsoft.com.domain > router.guest.corp.microsoft.com.40012: 20963 2/0/1 AAAA 2001:67c:1560:8003::c8, AAAA 2001:67c:1560:8003::c7 (99)
00:32:30.228771 IP router.guest.corp.microsoft.com.53833 > l.root-servers.net.domain: 55111 [1au] NS? . (40)
00:32:30.236915 IP6 router.55983 > 2001:4898::1050:5050.domain: 1370+ [1au] PTR? 42.83.7.199.in-addr.arpa. (53)
00:32:30.244452 IP6 2001:4898::1050:5050.domain > router.55983: 1370 1/0/1 PTR l.root-servers.net. (85)
00:32:30.639611 IP router.guest.corp.microsoft.com.45559 > i.root-servers.net.domain: 6094 [1au] DS? com. (44)
00:32:31.032377 IP router.guest.corp.microsoft.com.53155 > d.root-servers.net.domain: 40142 [1au] NS? . (40)
00:32:31.260698 IP6 router.47582 > 2001:4898::1050:5050.domain: 36313+ [1au] PTR? 0.5.0.5.0.5.0.1.0.0.0.0.0.0.0.0.0.0.0.0.0.0.0.0.8.9.8.4.1.0.0.2.ip6.arpa. (101)
00:32:31.268430 IP6 2001:4898::1050:5050.domain > router.47582: 36313 NXDomain 0/1/1 (181)
00:32:31.268595 IP6 router.47582 > 2001:4898::1050:5050.domain: 36313+ PTR? 0.5.0.5.0.5.0.1.0.0.0.0.0.0.0.0.0.0.0.0.0.0.0.0.8.9.8.4.1.0.0.2.ip6.arpa. (90)
00:32:31.276062 IP6 2001:4898::1050:5050.domain > router.47582: 36313 NXDomain 0/1/0 (170)
00:32:31.276784 IP6 router.55349 > 2001:4898::1050:5050.domain: 21609+ [1au] PTR? a.0.a.9.0.4.e.f.f.f.d.5.5.1.2.0.c.8.3.0.0.e.0.0.8.9.8.4.1.0.0.2.ip6.arpa. (101)
00:32:31.282515 IP6 2001:4898::1050:5050.domain > router.55349: 21609 NXDomain 0/1/1 (181)
00:32:31.282685 IP6 router.55349 > 2001:4898::1050:5050.domain: 21609+ PTR? a.0.a.9.0.4.e.f.f.f.d.5.5.1.2.0.c.8.3.0.0.e.0.0.8.9.8.4.1.0.0.2.ip6.arpa. (90)
00:32:31.288180 IP6 2001:4898::1050:5050.domain > router.55349: 21609 NXDomain 0/1/0 (170)
00:32:31.440369 IP router.guest.corp.microsoft.com.59446 > l.root-servers.net.domain: 60909 [1au] DS? com. (44)
00:32:31.837226 IP router.guest.corp.microsoft.com.38799 > c.root-servers.net.domain: 13801 [1au] NS? . (40)
00:32:32.252211 IP router.guest.corp.microsoft.com.52914 > d.root-servers.net.domain: 22448 [1au] DS? com. (44)
00:32:32.649089 IP router.guest.corp.microsoft.com.38503 > M.ROOT-SERVERS.NET.domain: 4078 [1au] NS? . (40)
00:32:33.056504 IP router.guest.corp.microsoft.com.49689 > c.root-servers.net.domain: 45718 [1au] DS? com. (44)
00:32:33.452369 IP router.guest.corp.microsoft.com.35648 > f.root-servers.net.domain: 2907 [1au] NS? . (40)
00:32:33.860465 IP router.guest.corp.microsoft.com.38727 > M.ROOT-SERVERS.NET.domain: 46449 [1au] DS? com. (44)
00:32:34.261163 IP router.guest.corp.microsoft.com.47714 > j.root-servers.net.domain: 20202 [1au] NS? . (40)
00:32:34.664390 IP router.guest.corp.microsoft.com.48706 > f.root-servers.net.domain: 44638 [1au] DS? com. (44)
00:32:35.068445 IP router.guest.corp.microsoft.com.32907 > e.root-servers.net.domain: 34010 [1au] NS? . (40)
00:32:35.468430 IP router.guest.corp.microsoft.com.48692 > j.root-servers.net.domain: 9244 [1au] DS? com. (44)
00:32:35.872467 IP router.guest.corp.microsoft.com.58664 > G.ROOT-SERVERS.NET.domain: 61917 [1au] NS? . (40)
00:32:36.272441 IP router.guest.corp.microsoft.com.34417 > e.root-servers.net.domain: 7520 [1au] DS? com. (44)
00:32:36.676415 IP router.guest.corp.microsoft.com.47600 > b.root-servers.net.domain: 6977 [1au] NS? . (40)
00:32:37.076425 IP router.guest.corp.microsoft.com.47357 > G.ROOT-SERVERS.NET.domain: 50846 [1au] DS? com. (44)
00:32:37.486166 IP router.guest.corp.microsoft.com.48976 > h.root-servers.net.domain: 15299 [1au] NS? . (40)
00:32:37.880403 IP router.guest.corp.microsoft.com.43979 > b.root-servers.net.domain: 24706 [1au] DS? com. (44)
00:32:38.284366 IP router.guest.corp.microsoft.com.57725 > k.root-servers.net.domain: 47627 [1au] NS? . (40)
00:32:38.684381 IP router.guest.corp.microsoft.com.43675 > h.root-servers.net.domain: 40850 [1au] DS? com. (44)
00:32:39.088365 IP router.guest.corp.microsoft.com.49402 > a.root-servers.net.domain: 23174 [1au] NS? . (40)
00:32:51.004498 IP router.guest.corp.microsoft.com.55573 > cusgaibluf5b01--commoncorp2-ip2.network.microsoft.com.domain: 17064+% [1au] A? ntp.ubuntu.com. (55)
00:32:51.004547 IP router.guest.corp.microsoft.com.47856 > i.root-servers.net.domain: 34970 [1au] NS? . (40)
00:32:51.004804 IP router.guest.corp.microsoft.com.55277 > cusgaibluf5b01--commoncorp2-ip2.network.microsoft.com.domain: 1934+% [1au] AAAA? ntp.ubuntu.com. (55)
00:32:51.010268 IP cusgaibluf5b01--commoncorp2-ip2.network.microsoft.com.domain > router.guest.corp.microsoft.com.55277: 1934 2/0/1 AAAA 2001:67c:1560:8003::c8, AAAA 2001:67c:1560:8003::c7 (99)
00:32:51.010545 IP router.guest.corp.microsoft.com.60847 > cusgaibluf5b01--commoncorp2-ip2.network.microsoft.com.domain: 64899+% [1au] DS? com. (44)
00:32:51.014323 IP cusgaibluf5b01--commoncorp2-ip2.network.microsoft.com.domain > router.guest.corp.microsoft.com.55573: 17064 4/0/1 A 91.189.89.198, A 91.189.89.199, A 91.189.91.157, A 91.189.94.4 (107)
00:32:51.808407 IP router.guest.corp.microsoft.com.39447 > l.root-servers.net.domain: 25355 [1au] NS? . (40)
00:32:52.218065 IP router.guest.corp.microsoft.com.38238 > i.root-servers.net.domain: 43198 [1au] DS? com. (44)
00:32:52.609184 IP router.guest.corp.microsoft.com.52761 > c.root-servers.net.domain: 36641 [1au] NS? . (40)
00:32:53.024373 IP router.guest.corp.microsoft.com.33526 > l.root-servers.net.domain: 41993 [1au] DS? com. (44)
00:32:53.416491 IP router.guest.corp.microsoft.com.53258 > d.root-servers.net.domain: 53340 [1au] NS? . (40)
00:32:53.833072 IP router.guest.corp.microsoft.com.54854 > c.root-servers.net.domain: 30969 [1au] DS? com. (44)
00:32:54.226948 IP router.guest.corp.microsoft.com.57199 > M.ROOT-SERVERS.NET.domain: 60083 [1au] NS? . (40)
00:32:54.645452 IP router.guest.corp.microsoft.com.41887 > d.root-servers.net.domain: 11018 [1au] DS? com. (44)
00:32:55.028377 IP router.guest.corp.microsoft.com.48260 > f.root-servers.net.domain: 36883 [1au] NS? . (40)
00:32:55.450304 IP router.guest.corp.microsoft.com.53125 > M.ROOT-SERVERS.NET.domain: 15953 [1au] DS? com. (44)
00:32:55.829081 IP router.guest.corp.microsoft.com.53562 > j.root-servers.net.domain: 31909 [1au] NS? . (40)

